ARESTTYPEID;ARESTTYPE
6595;Арест. транспортным отделом НКВД ДВЖД
6596;Арест. ДТО ОГПУ Уссурийской ж. д.
6597;Арест. 60 ПО ПП ОГПУ ДВК
6598;Арест. УКГБ на ДВЖД
6599;Арест. ОО НКВД ДВФ
6600;Арест. СПО УКГБ по Хабаровскому краю
6601;Арест. УКР "СМЕРШ" 1 ДВФ
6602;Арест. Амурским ОУНКВД
6603;Арест. СПО ПП ОГПУ
6604;Арест. ТО НКГБ ДВЖД ст. Бикин
6605;Арест. Кур-Урминским РО НКВД по ДВК
6606;Арест. 3 отд. УГБ УНКВД ДВК
6607;Арест. ОТО НКГБ ДВЖД ст. Литовко
6608;Арест. ОДТО ГУГБ НКВД ст. Владивосток
6609;Арест. УНКВД по ДВК Комсомольска-на-Амуре
6610;Арест. ОКР "СМЕРШ" 15 армии
6611;Арест. Блюхеровским РО НКВД ЕАО
6612;Арест. отделом Дальлага НКВД
6613;Арест. Управлением охраны МГБ на ДВЖД
6614;Арест. Восточным ИТЛ МВД
6615;Арест. ОО ОКДВА
6616;Арест. ПП ОГПУ по ДВК
6617;Арест. УГБ УНКВД
6618;Арест. Биробиджанским РО ОГПУ ДВК
6619;Арест. ОКР "СМЕРШ" КАФ
6620;Арест. Комсомольским ГО УНКВД по ДВК
6621;Арест. ОО НКВД особого стрелкового корпуса
6622;Арест. 63 ПО ВОГПУ ДВК
6623;Арест. отд. охраны МГБ ст. Бикин
6624;Арест. УНКВД по Хаб. краю
6625;Арест. ОБХСС УРКМ УНКВД по ДВК
6626;Арест. НКВД ст. Бабаево Северной ж. д.
6627;Арест. 11 отд. УГБ УНКВД ДВК
6628;Арест. 11 отд. УГБ УНКВД
6629;Арест. ОКР "СМЕРШ" 15 армии 2 ДВФ
6630;Арест. Вяземским РО УНКВД
6631;Арест. Аянской комендатурой 65 МПО НКВД
6632;Арест. ОКР "СМЕРШ" 292 стрелковой дивизии
6633;Арест. ЭКО УНКВД по Хабаровскому краю
6634;Арест. ОДТО ГУГБ НКВД ст. Облучье
6635;Арест. НКВД ДВЖД
6636;Арест. Нижне-Амурским ОО ОГПУ ДВК
6637;Арест. СПО ПП ОГПУ по ДВК
6638;Арест. УПВИ МВД по Хабаровскому краю
6639;Арест. 4-м отд-ем УГБ УНКВД
6640;Арест. Кур-Урминским РО НКВД Хабаровского края
6641;Арест. ОКР "СМЕРШ" армии ПВО
6642;Арест. ПО НКВД по П/к
6643;Арест. 65 МПО НКВД
6644;Арест. ОТО НКГБ ст. Литовко
6645;Арест. УМГБ по ЕАО
6646;Арест. Хабаровским ПО ПП ОГПУ
6647;Арест. ОТО ГУГБ УНКВД
6648;Арест. ОТО НКГБ ДВЖД ст. Бикин
6649;Арест. Иманским ПО ОГПУ
6650;Арест. ДТО НКВД ДВЖД
6651;Арест. ДТО ГУГБ НКВД
6652;Арест. Кур-Урминским УНКВД по ДВК
6653;Арест. Сов. МК ПП ОГПУ ДВК
6654;Арест. ОО ГУГБ ОКДВА
6655;Арест. Лазовским РО УНКВД по ДВК
6656;Арест. ТО ОГПУ Уссурийской ж. д. ст. Облучье
6657;Арест. УНКВД Хабаровского края
6658;Арест. 1 отд. СПО УНКВД по Хаб. кр.
6659;Арест. ОО ГУГБ НКВД 59 СД
6660;Арест. СПО УНКВД ДВК
6661;Арест. ОО ГУГБ НКВД
6662;Арест. Советским ГО УНКВД по Приморскому краю
6663;Арест. УГБ УНКВД ДВК
6664;Арест. Бикинским ПО ОГПУ ДВК
6665;Арест. ТО НКВД ДВЖД
6666;Арест. ДТО ГУГБ НКВД по ДВК
6667;Арест. ДТО УНКВД по ДВК
6668;Арест. отделом охраны МГБ ДВЖД
6669;Арест. ОО НКВД ОКДВА
6670;Арест. 77 ПО НКВД
6671;Арест. ОУНКВД ЕАО по ДВК
6672;Арест. 3 отделом УГБ УНКВД ЕАО
6673;Арест. как член семьи изменника Родины.
6674;Арест. оперотделом МВД Хабаровского кр.
6675;Арест. опергруппой КР "СМЕРШ" г. Хайлар
6676;Арест. УМГБ Хабаровского края
6677;Арест. ОС ОКДВА и УГБ НКВД по ДВК
6678;Арест. УПВИ УМВД Хабаровского края
6679;Арест. ОТО МГБ ст. Хабаровск-I
6680;Арест. 5 отд. УНКВД по ДВК
6681;Арест. Владивостокским ПО ОГПУ ДВК
6682;Арест. ОДТО ОГПУ ДВК
6683;Арест. Николаевским-на-Амуре ПП ОГПУ ДВК
6684;Арест. УНКГБ по Хабаровскому краю
6685;Арест. УМГБ по Хабаровскому краю
6686;Арест. РО НКВД Тугуро-Чумиканского р-на ДВК
6687;Арест. Нижне-Амурским отд. ОГПУ ДВК
6688;Арест. ОДТО ОГПУ Уссурийской ж. д.
6689;Арест. КРО УНКВД ЕАО
6690;Арест. УНКВД Амурской обл.
6691;Арест. СПО Дальлаг НКВД
6692;Арест. ОО ОГПУ ДВК
6693;Арест. СПО ОГПУ ДВК
6694;Арест. ОО УГБ и ОКДВА
6695;Арест. УГБ НКВД по ДВК как член семьи врага народа.
6696;Арест. Аянским погранучастком 65 МПО НКВД
6697;Арест. ОО Забайкальского фронта НКВД
6698;Арест. ГУГБ НКВД по ДВК
6699;Арест. УГБ УНКВД Хабаровского края
6700;Арест. Нижне-Амурским ОУНКГБ
6701;Арест. СПО УГБ УНКВД по ДВК
6702;Арест. ОО УГБ НКВД
6703;Арест. ОТКЗ ПП ОГПУ ДВК
6704;Арест. Бикинским РО ОГПУ ДВК
6705;Арест. Казакевичевским ПО НКВД
6706;Арест. УНКВД
6707;Арест. Аяно-Майским РО УГБ УНКВД
6708;Арест. УГБ ОУНКВД Нижне-Амурской обл.
6709;Арест. Нижне-Амурским ПП ОГПУ по ДВК
6710;Арест. УКПО ПП ОГПУ ДВК
6711;Арест. Сталинским РО НКВД
6712;Арест. 4 отд. УГБ УНКВД ДВК
6713;Арест. Совгаванским МК ПП ОГПУ
6714;Арест. 3 отделом УГБ УНКВД по ДВК
6715;Арест. ОО ПП и ОКДВ
6716;Арест. Николаевским ОС ПП ОГПУ ДВК
6717;Арест. ОО УГБ НКВД г. Комсомольска
6718;Арест. УГБ ОУНКВД ЕАО
6719;Арест. ОУНКВД по ЕАО
6720;Арест. Нижне-Амурским ОО ОГПУ
6721;Арест. УНКВД по ЕАО
6722;Арест. КРО ПП ОГПУ
6723;Арест. 3 отделом при Дальлаге НКВД
6724;Арест. РО УНКВД Сталинского р-на ЕАО
6725;Арест. Черниговским РОМ
6726;Арест. ТО ОГПУ Уссурийской ж. д.
6727;Арест. 6 отделом УГБ УНКВД
6728;Арест. ДТО ГУГБ НКВД ДВЖД
6729;Арест. ОДТО НКВД ст. Бикин
6730;Арест. ОКР "СМЕРШ" УНКВД по ДВК
6731;Арест. ОО ОГПУ по ДВК
6732;Арест. СТО ПП ДВК
6733;Арест. ОКР "СМЕРШ" Комсомольского гарнизона
6734;Арест. УНКГБ по ЕАО
6735;Арест. С.-Бурейским РО ОУНКВД
6736;Арест. Нижне-Амурским УНКВД ДВК
6737;Арест. Бикинским ПО УНКВД по ДВК
6738;Арест. Военной прокуратурой войск НКВД СССР
6739;Арест. Нижне-Амурским ОУНКВД ДВК
6740;Арест. Бикинским ПО НКВД
6741;Арест. 3 отд. УГБ УНКВД
6742;Арест. Нижне-Амурским ОО ПП ОГПУ ДВК
6743;Арест. Охотским РО НКВД
6744;Арест. ОО УГБ НКВД г. Комсомольска-на-Амуре
6745;Арест. ДТО УГБ УНКВД
6746;Арест. Хабаровским РО НКВД
6747;Арест. РО НКВД ЕАО
6748;Арест. Ульчским РО УГБ УНКВД
6749;Арест. Биробиджанским РО ОГПУ
6750;Арест. СПО УГБ УНКВД ДВК
6751;Арест. Де-Кастринским ОО НКВД
6752;Арест. Аяно-Майским РО НКВД
6753;Арест. опер. отделом лагеря № 16 МВД СССР
6754;Арест. Вяземским РО НКВД
6755;Арест. отделом охраны МГБ ст. Хабаровск-I
6756;Арест. Советским РОМ НКВД
6757;Арест. Николаевским-на-Амуре ОО ПП ОГПУ ДВК
6758;Арест. УО МГБ на ДВЖД
6759;Арест. Блюхеровским РО НКВД ЕАО по ДВК
6760;Арест. Блюхеровским РО НКВД в ЕАО
6761;Арест. Комсомольским ГО НКВД по ДВК
6762;Арест. ЭКО УГБ НКВД по ДВК
6763;Арест. ДТО УГБ НКВД ст. Бикин
6764;Арест. ОО ГУГБ НКВД АКВФ
6765;Арест. 56 ПО НКВД г. Бикина
6766;Арест. Охотским РО УНКВД
6767;Арест. погранзаставой ОГПУ
6768;Арест. Сталинским РО НКВД ЕАО
6769;Арест. ОУНКВД по ДВК ЕАО
6770;Арест. СПО УГБ УНКВД
6771;Арест. Блюхеровским РО НКВД ЕАО ДВК
6772;Арест. 57 ПО ОГПУ
6773;Арест. ДТО ГУГБ ДВЖД
6774;Арест. Бирским РО НКВД по ЕАО
6775;Арест. 11 отделением Бурлага НКВД
6776;Арест. Николаевским-на-Амуре ОГПУ ДВК
6777;Арест. ДТО ГУГБ НКВД ДВК
6778;Арест. Бикинским ПО ОГПУ
6779;Арест. ОО УГБ УНКВД при 34 СД
6780;Арест. 5 отд. УГБ УНКВД по ДВК
6781;Арест. УКР "СМЕРШ" ДВ фронта.
6782;Арест. Лазовским РО НКВД по ДВК
6783;Арест. Е.-Никольским РО НКВД
6784;Арест. 3 отд. КРО ПП ОГПУ ДВК
6785;Арест. ТО НКВД по Хабаровскому краю
6786;Арест. ОКР "СМЕРШ" 15 корпуса
6787;Арест. 6 отд. УГБ УНКВД ДВК
6788;Арест. ЭКО УНКВД
6789;Арест. ДТО ОГПУ ДВК
6790;Арест. Водным отделом НКГБ Амурского бассейна
6791;Арест. ОО УГБ НКВД 34 стрелковой дивизии
6792;Арест. Московским ОГПУ
6793;Арест. Комсомольским РО ОГПУ ДВК
6794;Арест. Комсомольским ГО ОГПУ ДВК
6795;Арест. 2 отд. УГБ УНКВД
6796;Арест. РО ОГПУ ДВК
6797;Арест. ОББ УНКВД по Хабаровскому краю
6798;Арест. УМГБ по Ростовской обл.
6799;Арест. прокуратурой Хабаровского края
6800;Арест. ТО ОГПУ ст. Хабаровск
6801;Арест. Бирским РО УНКВД в ЕАО
6802;Арест. РО ПП ОГПУ ДВК
6803;Арест. Вяземским РО УНКВД по ДВК
6804;Арест. Вяземским РО УНКВД ДВК
6805;Арест. ДТО ГУГБ ДВК
6806;Арест. Кербинским ПП ОГПУ ДВК
6807;Арест. КРО ПП ОГПУ по ДВК
6808;Арест. Биробиджанским ПО НКВД
6809;Арест. Хабаровским кавалерийским ПО ОГПУ
6810;Арест. в г. Николаевске-на-Амуре.
6811;Арест. УНКВД в ЕАО по ДВК
6812;Арест. КРО ОО ОГПУ ДВК
6813;Арест. 2 отд. УГБ УНКВД по ДВК
6814;Арест. отделом ж. д. милиции Комсомольска-на-Амуре
6815;Арест. ТО НКГБ ст. Вяземская ДВЖД
6816;Арест. Хабаровским РО УНКВД по ДВК
6817;Арест. ОКР "СМЕРШ" базы КАФ
6818;Арест. ОО НКВД ДВК
6819;Арест. Бурлагом НКВД
6820;Арест. ОДТО ГУГБ НКВД ДВЖД
6821;Арест. Совгаванским РО ОГПУ по ДВК
6822;Арест. СПО УНКГБ по ДВК
6823;Арест. ГУГБ НКВД ДВЖД
6824;Арест. Вяземской ПК НКВД
6825;Арест. 4 отд. УГБ НКВД
6826;Арест. Нижне-Амурским УГБ ОУНКВД
6827;Арест. УМВД Хабаровского края
6828;Арест. ОТО НКВД ДВЖД
6829;Арест. Вяземским РО НКВД ДВК
6830;Арест. Нижне-Амурским РО НКВД
6831;Арест. Нанайским РО НКВД
6832;Арест. Нанайским ОРО НКВД
6833;Арест. СПО УГБ Нижне-Амурского ОУНКВД
6834;Арест. ОС ОГПУ по ДВК
6835;Арест. СО ПП ОГПУ ДВК
6836;Арест. МК ПП ОГПУ ДВК
6837;Арест. ОК ОГПУ
6838;Арест. Матвеевским РО НКВД
6839;Арест. ОС ОГПУ ДВК
6840;Арест. Николаевским-на-Амуре ОО ОГПУ ДВК
6841;Арест. Совгаванским РО НКВД
6842;Арест. 2 отд. УНКГБ Хабаровского края
6843;Арест. Ульчским РО НКВД
6844;Арест. Бикинским ПО НКВД по ДВК
6845;Арест. ОББ УНКВД
6846;Арест. 4 отд. ТО НКГБ ДВЖД
6847;Арест. УГБ НКВД ЕАО
6848;Арест. 6 отд. УГБ УНКВД по ДВК
6849;Арест. ОУНКВД по ДВК
6850;Арест. Николаевским ОС ОГПУ ДВК
6851;Арест. ДТО ГУГБ НКВД по ДВК, как член семьи изменника Родины.
6852;Арест. Советским РО НКВД по ДВК
6853;Арест. ОО ГУГБ НКВД по ДВК
6854;Арест. ОО ОГПУ Амурской флотилии
6855;Арест. Вяземским РОМ НКВД
6856;Арест. Дальлагом НКВД
6857;Арест. ОДТО НКВД
6858;Арест. ОДТО ГУГБ НКВД ст. Бикин
6859;Арест. ОО УГБ УНКВД ДВК
6860;Арест. 4 отд. УГБ НКВД ДВК
6861;Арест. УКР МГБ Забайкальского ВО
6862;Арест. оперпунктом ТО УГБ НКВД ст. Вяземская.
6863;Арест. Казакевическим ПО НКВД
6864;Арест. УМВД по Нижне-Амурской обл.
6865;Арест. ОО НКВД с/л № 283
6866;Арест. Комсомольским ГО УГБ НКВД
6867;Арест. ПО ПП ОГПУ ДВК
6868;Арест. ОУНКВД ЕАО ДВК
6869;Арест. Сталинским ОС УНКВД ДВК
6870;Арест. ОКР "СМЕРШ" 17 армии Забайкальско-Амурского ВО
6871;Арест. 11 отд. УГБ НКВД ДВК
6872;Арест. ОО 110-й авиабригады
6873;Арест. 6 отд. УГБ УНКВД
6874;Арест. Управлением охраны МГБ ДВЖД
6875;Арест. Покровским РО ОГПУ ДВК
6876;Арест. Кербинским РО НКВД
6877;Арест. ОО НКВД АКФ
6878;Арест. ДТО ОГПУ ст. Лазо Уссурийской ж. д.
6879;Арест. ДТО ОГПУ Уссур. ж. д.
6880;Арест. КРО УНКВД по ЕАО
6881;Арест. ТО НКВД ДВЖД ст. Вяземская
6882;Арест. ОКР "СМЕРШ" СТОФ
6883;Арест. ОУНКВД ст. Облучье ЕАО
6884;Арест. 11 отделом УГБ УНКВД по ДВК
6885;Арест. Амурским ОУНКВД по ДВК
6886;Арест. СПО НКВД
6887;Арест. Калининским РО УГБ НКВД по ДВК
6888;Арест. УНКВД по Приморскому краю
6889;Арест. следственным отделом УНКГБ
6890;Арест. ТО НКГБ ст. Биробиджан
6891;Арест. ТО МГБ ДВЖД
6892;Арест. Кур-Урминским ОУНКВД по ДВК
6893;Арест. УСО ПП ОГПУ ДВК
6894;Арест. МГБ 39 армии
6895;Арест. МГБ Амурского речного бассейна
6896;Арест. 2 отд. УГБ УНКВД по Хабаровскому краю
6897;Арест. Николаевским ОС СПО ОГПУ
6898;Арест. ТО ОГПУ ДВК
6899;Арест. 5 отд. ПП ОГПУ ДВК
6900;Арест. Охотским РО НКВД по ДВК
6901;Арест. СПО НКВД по ДВК
6902;Арест. Хабаровским РО НКВД по ДВК
6903;Арест. ПК НКВД 62 морпогранотряда
6904;Арест. ЭПО ПП ОГПУ ДВК
6905;Арест. Смидовичевским РО НКВД
6906;Арест. ОДТО ОГПУ ст. Облучье
6907;Арест. УКР НКО "СМЕРШ"
6908;Арест. прокуратурой г. Комсомольска-на-Амуре
6909;Арест. Комсомольским РО ОГПУ
6910;Арест. Николаевским РО ОГПУ ДВК
6911;Арест. Нижне-Амурским УНКВД
6912;Арест. ОО ОГПУ 57 Уральской стрелковой дивизией
6913;Арест. КП ОГПУ ДВК
6914;Арест. ОО НКВД 15 армии
6915;Арест. ГУГБ УНКВД по ДВК
6916;Арест. кавалерийским ПО ОГПУ ДВК
6917;Арест. Благовещенским ПО ОГПУ ДВК
6918;Арест. Лазовским РО НКВД ДВК
6919;Арест. Военной прокуратурой ДВЖД
6920;Арест. Николаевским ОО ОГПУ ДВК
6921;Арест. ОТО НКВД ДВЖД ст. Облучье
6922;Арест. 61 ПО ПП ОГПУ ДВК
6923;Арест. ОО ПП и ОКДВО
6924;Арест. ОО УГБ НКВД по ДВК
6925;Арест. ОКР МГБ 39 армии
6926;Арест. Уссурийским ОУНКВД
6927;Арест. ОО ОГПУ Амурской КВФ
6928;Арест. Н.-Уссурийским ГО ОГПУ
6929;Арест. 3 отделом УГБ АКФ
6930;Арест. Кур-Урминским РО УНКВД ДВК
6931;Арест. ОКР НКО "СМЕРШ" 15 армии 2 ДВ фронта
6932;Арест. Н.-Амурским ОУНКВД ДВК
6933;Арест. Охотско-Колымским ПО ОГПУ ДВК
6934;Арест. 3 отд. Дальлага НКВД
6935;Арест. КРУМ УНКВД по ДВК
6936;Арест. ОМВД Амурского бассейна
6937;Арест. 57 Хабаровским кавалерийским ПО ОГПУ
6938;Арест. оперотделом Управления лагеря № 40 МВД
6939;Арест. УНКВД ЕАО
6940;Арест. опергруппой УКР "СМЕРШ" Заб. фронта
6941;Арест. УМГБ Черниговской обл.
6942;Арест. Кур-Урминским РО НКВД
6943;Арест. Комсомольским ГО МГБ
6944;Арест. ОС ПП ОГПУ ДВК
6945;Арест. Ульчским РО УГБ НКВД
6946;Арест. УНКВД по Хабаровскому краю.
6947;Арест. ОУНКВД ДВК
6948;Арест. ОУР УРКМ УНКВД по ДВК
6949;Арест. ОКР "СМЕРШ" АКФ
6950;Арест. Нижне-Амурским РКМ НКВД
6951;Арест. Комсомольским ГО УМГБ по Хабаровскому краю
6952;Арест. 3 отд. при Дальлаге НКВД
6953;Арест. СОУ ПП ОГПУ ДВК
6954;Арест. ТО НКГБ
6955;Арест. Хинганским ПО НКВД
6956;Арест. ОУР КРУМ УНКВД ДВК
6957;Арест. УГБ УНКВД ст. Бира
6958;Арест. ПО ОГПУ ДВК
6959;Арест. Нижне-Амурским НКВД
6960;Арест. Нижне-Амурским ПП ОГПУ ДВК
6961;Арест. ДТО ПП ОГПУ по Уссурийской ж. д.
6962;Арест. Нижне-Амурским УМГБ
6963;Арест. Бирским ОУНКВД ДВК
6964;Арест. 76 ПО НКВД ДВК
6965;Арест. УРКМ УНКВД по ДВК
6966;Арест. УПВИ МВД Хабаровского края
6967;Арест. УГБ УНКВД и ОО ОКДВА
6968;Арест. ОО УГБ УНКВД
6969;Арест. БКПО НКВД по ДВК
6970;Арест. Иманским ПО ОГПУ ДВК
6971;Арест. следственным отделом Хабаровского края
6972;Арест. 1 отделом КПВВ НКВД
6973;Арест. 76 ПО НКВД
6974;Арест. 3 отд. УГБ НКВД по ДВК
6975;Арест. Бикинским 77 ПО НКВД
6976;Арест. 77 Бикинским ПО НКВД
6977;Арест. ОКР "СМЕРШ" г. Хайлар
6978;Арест. 4 отд. КРО НКВД
6979;Арест. 1 отд. УМГБ Хабаровского края
6980;Арест. Кур-Урмийским РО НКВД
6981;Арест. Бикинским РО НКВД ДВК
6982;Арест. Бикинским ПО НКВД ДВК
6983;Арест. ОКР "СМЕРШ" 88 ОСБ
6984;Арест. Казакевичевским 70 ПО НКВД
6985;Арест. МГБ Забайкальского ВО
6986;Арест. 78 ПО НКВД
6987;Арест. Нижне-Амурским КРО НКВД
6988;Арест. Нанайским РО НКВД по ДВК
6989;Арест. 63 Биробиджанским ПО НКВД
6990;Арест. ПО НКВД
6991;Арест. 62 МПО НКВД
6992;Арест. 77 Бикинским ПО НКВД по ДВК
6993;Арест. ОУР УНКВД по ДВК
6994;Арест. 58 ПО НКВД ДВК
6995;Арест. 56 ПО НКВД
6996;Арест. Уссурийским ОТКЗ ПО НКВД
6997;Арест. Амурским окротделом ОГПУ ДВК
6998;Арест. 5 отд. УГБ УНКВД ДВК
6999;Арест. Хабаровским ОТКЗ кав. ПО
7000;Арест. Хинганским 76 ПО НКВД
7001;Арест. Вяземским ПК НКВД
7002;Арест. Бикинским РОМ УНКВД по ДВК
7003;Арест. 55 ПО НКВД
7004;Арест. 76 ПО НКВД по ДВК
7005;Арест. Казакевичевским ПО НКВД по ДВК
7006;Арест. Бикинским 77 ПО НКВД по ДВК
7007;Арест. 63 ПО НКВД по ЕАО
7008;Арест. ОКР "СМЕРШ" 2-го ДВ фронта
7009;Арест. Вяземским ПО НКВД
7010;Арест. 63 ПО НКВД
7011;Арест. 2 отд. УНКВД по ДВК
7012;Арест. 56-м ПО НКВД
7013;Арест. УКР "СМЕРШ" 15-й армии
7014;Арест. КПВВ НКВД ДВО
7015;Арест. ОКР "СМЕРШ" 2 КАФ ДВ фронта
7016;Арест. ОО НКВД по ДВК
7017;Арест. 70 ПО НКВД ЕАО
7018;Арест. Управлением охраны МВД на ДВЖД
7019;Арест. Аяно-Майским ПП ОГПУ
7020;Арест. Биробиджанским РО ПП ОГПУ по ДВК
7021;Арест. РО НКВД р-на им. П.-Осипенко
7022;Арест. РО НКВД ДВК
7023;Арест. отд. УРКМ УНКВД по Хабаровскому краю
7024;Арест. Хабаровским Кав. ОТКЗ ПО ОГПУ
7025;Арест. Дальлагом ОГПУ ДВК
7026;Арест. Тугуро-Чумиканским РО НКВД
7027;Арест. Смидовическим РО НКВД
7028;Арест. Управлением контрразведки "СМЕРШ" 1 ДВФ
7029;Арест. Блюхерским РО НКВД
7030;Арест. Николаевским ОГПУ ДВК
7031;Арест. ОДТО ГУГБ НКВД ст. Бикин ДВЖД
7032;Арест. ОДТО УГБ НКВД ст. Вяземская
7033;Арест. Ульчским РО ОГПУ ДВК
7034;Арест. ОО НКВД Забайкальского фронта
7035;Арест. 11 отд. Нижне-Амурской обл.
7036;Арест. Комсомольским НКВД по ДВК
7037;Арест. Водным отделом МГБ Амурского бассейна
7038;Арест. ОКР "СМЕРШ" 15 армии 2 ДВ фронта
7039;Арест. ОУМГБ по Хабаровскому краю.
7040;Арест. ТО УГБ УНКВД ст. Бикин
7041;Арест. Н.-Амурским ОУ НКВД
7042;Арест. 3 отд. УГБ УНКВД Хабаровского края
7043;Арест. ДТО ПП ОГПУ ДВК по Уссурийской ж. д.
7044;Арест. ТО УГБ УНКВД по ДВК
7045;Арест. Прокуратурой ОКДВА
7046;Арест. Комсомольским ГО НКГБ
7047;Арест. 77 ПО НКВД по ДВК
7048;Арест. СПО УНКВД по Хабаровскому краю
7049;Арест. УКР "СМЕРШ" 2ДВ фронта
