ARESTTYPEID;ARESTTYPE
0;
1;Арестован, с
2;Обвинение предъявлено
3;Арестован не был.
4;подписка о невыезде.
5;Взята подписка о невыезде
6;Задержан
7;предъявлено обвинение
8;Уголовное дело возбуждено
9;привлечен к уголовной ответственности
10;*****
11;взята подписка о невыезде.
12;Объявлен в розыск.
13;взята подписка о невыезде. Предъявлено обвинение по ст. 58-10 ч.1.
14;Содержался в окружной псих. лечебнице с
15;взята подписка о невыезде. Предъявлено обвинение по ст. 58-11.
16;Привлечен к ответственности
17;возбуждено дело
18;объявлен в розыск
19;дело приостановлено в связи с побегом, объявлен в розыск.
20;Привлечен к ответственности за антиколхозную деятельность и провокационные слухи
21;был арестован
22;Арестован третий раз
23;возбуждено уголовное дело
24;дело принято к производству
25;заочно объявлен вне закона.
26;привлекался к ответственности
27;арестовывался
28;привлечена к ответственности
29;подписка о невыезде
30;привлечен в качестве обвиняемого
31;Не арестован.
32;допрошен в качестве подозреваемого
33;допрошен в качестве подозреваемого.
34;Не арестована.
35;допрашивался в качестве обвиняемого.
36;допрашивалась в качестве подозреваемой.
37;объявлен розыск.
38;предъявлено обвинение.
39;выписан ордер на арест.
40;Находится в розыске.
41;объявлен розыск
42;Задержана
43;Аресту не подвергался.
44;Дело возбуждено
45;Привлекался
46;Арестован:
47;привлечена
48;Находился в розыске
49;точных данных о дате ареста нет
50;задержан при побеге
51;Арестован по "Академическому делу"
52;находился под подпиской
53;Ареста не было, находился в лазарете.
54;привлекался к уголовной ответственности
55;привлекалась к уголовной ответственности
56;Не арестовывался, находился в лазарете.
57;Мера пресечения не избиралась.
58;аресту не подвергался
59;Аресту не подвергалась
60;Не арестовывался
61;Постановление об аресте
62;Санкция на арест
63;Арестоваан
64;Привлечена к следствию
65;Привлечен к следствию
66;взят в плен в с. Мокроусово.
67;Предъявлено новое обвинение
68;задержан заградотрядом
69;Содержался в Челябинской тюрьме особого назначения.
70;Этапирован в Москву летом 1937
71;Доставлен в Москву
72;Этапирован в Москву
73;доставлен в Москву во Внутреннюю тюрьму особого назначения НКВД СССР.
74;Доставлен в Москву в Бутырскую тюрьму
75;Этапирован в Москву во Внутреннюю тюрьму НКВД СССР
76;Арестован в
77;Доставлен в Москву в Лефортовскую тюрьму
78;Доставлена в Москву
79;предъявлено новое обвинение.
80;Доставлена в Москву в Бутырскую тюрьму
81;этапирован в Москву в нач. 1938
82;этапирован в Москву.
83;дело принято к производству.
84;Ссылку отбывал в Семипалатинске.
85;надзор по месту жительства
86;Арестов
87;арестов.
88;арестован Новониколаевской уездной ЧК
89;дело вновь возбуждено
90;был под следствием с
91;привлечен к уголовной ответственности.
92;Арестована
93;арестован
94;аресто-вана
95;Арестован
96;подп.о невыезде
97;в розыске
98;Не арестовывалась
99;Был в розыске
100;(объявлен в розыск)
101;Арестована не была
102;Арестован не был
103;Обыск
104;Не арестована
105;Арестован Мурашинским РО НКВД
106;взята подписке о невыезде.
107;Арестован в ТАССР
108;Арестована на ст. Казань
109;Арестована на ст.Казань
110;Арестован г
111;Арестован года.
112;Арестован н 20.09.1989г. военной прокуратурой ПриВО.
113;Арестован Обвинялся в убийстве колхозника-активиста Субботина.
114;Арестована Вольским РО НКВД.
115;Арестована года.
116;Арестована 4 - ым отделом ГБ НКВД Саратовской области.
117;Арестован Вязовским РА ОГПУ.
118;Арестован Ершовским РО НКВД.
119;Арестован Ивантеевским РО НКВД.
120;Арестован Аткарским РО ОГПУ.
121;Арестован НКГБ АССР НП.
122;Арестован ГПУ РНП.
123;Арестован года
124;Арестована УНКВД по Саратовской области.
125;Арестован НКВД АССР НП.
126;Арестован РО НКВД.
127;Арестован НКВД РНП.
128;Арестован НКВД Саратовской области.
129;Арестован НКВД.
130;Арестован Вязовским РО НКВД.
131;Арестован УНКВД по Саратовской области.
132;Арестован Куккусским КО НКВД.
133;Арестован Мариентальским КО НКВД.
134;Арестован Куккусским РО НКВД.
135;Арестован ОГПУ.
136;Арестован Каменским КО НКВД.
137;Арестован УНКВД.
138;Арестован УГБ НКВД Саратовской области.
139;Арестован ГПУ.
140;Арестован ОГПУ по НВК.
141;Арестован НКВД АССР НП
142;Арестован УНКВД по Саратовскому краю.
143;Арестован УГБ Саратовской области.
144;Арестован УНКВД Саратовской области.
145;Арестован УНКВД Саратовского края.
146;Арестован Саратовским УНКВД.
147;Арестована УНКВД.
148;Арестована НКВД при ЦХП КА.
149;Арестована года
150;Арестован ГПУ РНП
151;Арестован Краснопартизанским РО УНКВД.
152;Арестован Марксштадским КО НКВД.
153;Арестован КО НКВД.
154;Арестован КО НКВД АССР НП.
155;Арестован УНКВД АССР НП.
156;Арестована УМГБ Саратовской области.
157;Арестован Вольским РО НКВД.
158;Арестован Балашовским РО НКВД.
159;Арестован Зельманским РО НКВД.
160;Арестован РО УНКВД.
161;Арестован НКВД СССР.
162;Арестован УНКГБ.
163;Арестован ОО НКВД.
164;Арестован НКВД РУ ж.д.
165;Арестован УГБ по Саратовской области.
166;Арестован УГБ НКВД.
167;Арестован ОГПУ г. Бальцера.
168;Арестована ОГПУ.
169;Арестован Аркадакским РО НКВД.
170;Арестован НКВД Забайкальского Военного Округа.
171;Арестован Бальцерским РО НКВД.
172;Арестован УМГБ по Саратовской области.
173;Арестован НКВД по Саратовской области.
174;Арестован ПП ОГПУ по НВК.
175;Арестован ОО ОГПУ.
176;Арестован НКВД по Ленинградской области.
177;Арестован НКВД по Саратовскому краю.
178;Арестован ОГПУ ДВК.
179;Арестован НКВД Саратовского края.
180;Арестован УНКВД РНП.
181;Арестована НКВД АССР НП.
182;Арестована УГБ НКВД СССР.
183;Арестована НКВД.
184;Арестован УНКВД Молотовской области.
185;Арестован Ней - Вальтерским РО НКВД.
186;Арестован Вольским Горотделом УНКВД.
187;Арестован УНКГБ по Саратовской области.
188;Арестован Жерновским РО НКВД.
189;Арестован Петровским РО НКВД.
190;Арестована Особым Совещанием НКВД СССР
191;Арестован Балашовским ОГПУ.
192;Арестован Лысогорским РО НКВД.
193;Арестован Духовницким РО УГБ НКВД.
194;Арестован ОГПУ РНП
195;Арестован НКВД Узбекской ССР.
196;Арестован УНКВД по Саратовской облаксти.
197;Арестован Аткарским РО УНКВД.
198;Арестован ОГПУ АССР НП
199;Арестован Вольским ОГПУ.
200;Арестован Аткарским РО УНКГБ.
201;Арестован Балаковским РО НКВД.
202;Арестована Пугачевским РО НКВД.
203;Арестован Чапаевским РО НКВД.
204;Арестован Зельманским КО НКВД.
205;Арестован Зельманским КО НКВД РНП.
206;Арестован Бакурским РО НКВД.
207;Арестована РО НКВД.
208;Арестован Аткарским ОО ОГПУ.
209;Арестован Новоузенским РО УНКВД.
210;Арестован Широко - Карамышским РО НКВД.
211;Арестован Новоузенским РО ОГПУ.
212;Арестован ПП ОГПУ.
213;Арестован Питерским РО НКВД.
214;Арестован УГБ УНКВД по Саратовской области.
215;Арестован НКГБ.
216;Арестован Александрово - гайским РО УНКВД.
217;Арестован Аркадакским РО УНКВД Саратовской области.
218;Арестован УГБ УНКВД Саратовской области.
219;Арестован Пугачевским ОО ОГПУ.
220;Арестован Хвалынским РО ОГПУ по НВК.
221;Арестован Кистендейским РО НКВД Саратовской области.
222;Арестована Вольским ОО ОГПУ.
223;Арестована ОГПУ по НВК.
224;Арестована Вольским ГО УНКВД.
225;Арестована Макаровским РО УНКВД.
226;Арестована Вольским ГО НКВД.
227;Арестован Широко - Буеракским РО УНКВД.
228;Арестован ОБХСС УРКМ.
229;Арестован Пугачевским РО УНКВД.
230;Арестован Дергачевским РО УНКВД.
231;Арестован ГПУ по НВК.
232;Арестован УНКВД по Рязанской области.
233;Арестован УГБ НКВД по Саратовской области.
234;Арестован Вольским ГО УНКВД.
235;Арестован Вольским ОО ОГПУ.
236;Арестован ОДТО ГУГБ станции Ртищево.
237;Арестован РОМ НКВД Аркадакского района.
238;Арестован Пугачевским ГО НКГБ.
239;Арестована Турковским РО УНКВД по Саратовской области.
240;Арестован Балашовским УНКВД.
241;Арестован УГБ УНКВД.
242;Арестован ДТО ГУГБ НКВД РУ ж.д.
243;Арестован Клинцовским РО УНКВД.
244;Арестован Золотовским КО НКВД АССР НП.
245;Арестован Салтыковским РО УНКВД.
246;Арестован Аркадакским РО УНКВД.
247;Арестован Черкасским РО УНКВД.
248;Арестован Красно - Кутским КО НКВД.
249;Арестован Хвалынским РО НКВД.
250;Арестован Федоровским КО НКВД РНП.
251;Арестована Петровским РО НКВД.
252;Арестован РО УГБ НКВД.
253;Арестован Петровским РО УНКВД.
254;Арестован Балашовским ОО ОГПУ.
255;Арестован Вязовским РО УНКВД.
256;Арестован Озинским РО НКВД.
257;Арестован Краснопартизанским РО НКВД.
258;Арестован Заволжским ОО ОГПУ.
259;Арестована РО УНКГБ.
260;Арестован КРаснопартизанским РО НКВД
261;Арестован МВД.
262;Арестован ДТО НКВД РУ ж.д.
263;Арестован Пугачевским РА ОГПУ по НВК.
264;Арестован РО УНКВД по Саратовской области.
265;Арестован Баландинским РО НКВД.
266;Арестован Бакурским РО УНКВД.
267;Арестован Баландинским РО УНКВД.
268;Арестован Вязовским РО УНКВД Саратовской области.
269;Арестован Питерским РО УНКВД.
270;Арестован Ершовским РО УНКВД.
271;Арестована Пугачевским РО УНКВД.
272;Арестован Пугачевским ОГПУ.
273;Арестован Пугачевским РО НКВД.
274;Арестован ОГПУ по Саратовской области.
275;Арестован Широко - Буеракским РО НКВД.
276;Арестован Перелюбским РО НКВД.
277;Арестован Широко - Буракским РО НКВД.
278;Арестован ОТО НКГБ станции Аткарск РУ ж.д.
279;Арестован ЭКО УНКВД по Саратовской области.
280;Арестована УГБ УНКВД по Саратовской области.
281;Арестован ГПУ АССР НП.
282;Арестован ЭКО ОГПУ по НВК.
283;Арестован Ленинградским УНКВД.
284;Арестован Самойловским РО УНКВД.
285;Арестован Балашовским РО УНКВД.
286;Арестован Перелюбским РО ОГПУ.
287;Арестован Красавским РО УНКВД.
288;Арестован Кистендейским РО УНКВД.
289;Арестован Экгеймским КО НКВД РНП.
290;Арестован Романовским РО УНКВД.
291;Арестован Балаковским РО УНКВД.
292;Арестован Ивантеевским РО УНКВД.
293;Арестован Хвалынским РО ПП ОГПУ.
294;Арестован ПП ОГПУ Саратовского края.
295;Арестован Хвалынским РО УНКВД.
296;Арестован Марксштадским РО УНКВД.
297;Арестован Новорепинским РО УНКВД.
298;Арестован Новоузенским РО НКВД.
299;Арестована УНКГБ.
300;Арестована РО УНКВД.
301;Арестован Балтайским РО УГБ НКВД по Саратовской области.
302;Арестован Бальцерским РО УНКВД.
303;Арестован Красноармейским РО МГБ по Саратовской области.
304;Арестован Каменской милицией.
305;Арестован Пугачевским РО УНКВД по Саратовской области.
306;Арестован Экгеймским КО НКВД.
307;Арестован Красноярским КО НКВД АССР НП.
308;Арестован Марксштадским КО НКВД РНП.
309;Арестован Ней - Вальтерским РО УНКВД.
310;Арестован Балашовским РО ОГПУ по НВК.
311;Арестована УГБ НКВД.
312;Арестован УНКВД РНП
313;Арестован Красноармейским РО НКВД.
314;Арестована УГБ НКВД РНП.
315;Арестован Балтайским РО НКВД.
316;Арестована НКВД Саратовской области.
317;Арестована Салтыковским РО УНКВД.
318;Арестован Чапаевским РО УНКВД.
319;Арестован Дергачевским РО НКВД.
320;Арестован Бальцерским КО НКВД.
321;Арестован Лысогорским РО УНКВД.
322;Арестован РО НКГБ.
323;Арестован Аркадакским РО НКВД
324;Арестован ОО НКВД СКФ г. Армавира.
325;Арестован СО ГПУ РНП.
326;Арестован ОО Каменлага НКВД.
327;Арестован Самойловским РО НКВД.
328;Арестован Балашовским РО ПП ОГПУ по НВК.
329;Арестован Марксштадским КО УНКВД АССР НП.
330;Арестован Красно - Кутским РО НКВД.
331;Арестован Терновским НО НКВД АССР НП.
332;Арестован УНКГБ Саратовской области.
333;Арестован ОТО НКВД РУ ж.д.
334;Арестован ОТО УГБ НКВД СК РУ ж.д.
335;Арестован Красно - Кутским КО УГБ НКВД по Саратовскому краю.
336;Арестован Аркадакским РО НКВД по Саратовской области.
337;Арестован РО НКВД по Саратовскому краю.
338;Арестован ТО НКВД РУ ж.д.
339;Арестован Балашовским РА ПП ОГПУ НВК.
340;Арестован ГУГБ НКВД.
341;Арестована Ново - Покровским РО НКВД.
342;Арестован ОДТО ГУГБ.
343;Арестована КО НКВД РНП.
344;Арестован Бальцерским КО ОГПУ.
345;Арестован Золотовским КО НКВД РНП.
346;Арестован Красно - Кутским КО НКВД РНП.
347;Арестован ОДТО НКВД станции Покровск.
348;Арестован НКВД РНП
349;Арестован Красно - Ярским КО НКВД РНП.
350;Арестован Красно - Ярским КО НКВД.
351;Арестован Красно - Ярским КО НКВД. РНП.
352;Арестован Золотовским КО НКВД.
353;Арестован Бальцерским ГПУ РНП.
354;Арестован ДТО НКВД.
355;Арестован Черкасским РО НКВД по Саратовской области.
356;Арестован Новоузенским РО НКВД по Саратовской области.
357;Арестован Баландинским РО УНКВД по Саратовской области.
358;Арестован ТО НКГБ РУ ж.д.
359;Арестована Аркадакским РО НКВД.
360;Арестована СПО УГБ УНКВД Саратовского края.
361;Арестован Балтайским РО НКВД по Саратовской области.
362;Арестован Федоровским КО НКВД.
363;Арестован ОО ГУГБ НКВД 61 - ой СД.
364;Арестован ТО УГБ НКВД.
365;Арестован УГБ НКВД АССР НП.
366;Арестован ДТО ГУГБ НКВД.
367;Арестован НКВД "Смерш" 36 - ОЙ Дивизии КВ НКВД.
368;Арестован Хвалынским РО ОГПУ.
369;Арестован Балашовским РА ОГПУ.
370;Арестован Макаровским РО НКВД.
371;Арестован Турковским РО НКВД.
372;Арестован ОКР "Смерш" 2 гв. АПКД.
373;Арестована ТО НКВД РУ ж.д.
374;Арестован Кистендейским РО НКВД.
375;Арестована Аткарским ОДТО ГУГБ НКВД.
376;Арестован ОДТО РУж.д.
377;Арестован ДТО УНКВД РУж.д.
378;Арестован Вольским 00 ОГПУ.
379;Арестован Куриловским РО УНКВД.
380;Арестован Балаковским РА ОГПУ.
381;Арестован ОГПУ НВК.
382;Арестован Балаковским РО ОГПУ.
383;Арестована Пугачёвским РО УНКВД.
384;Арестована Куриловским РО УНКВД.
385;Арестован Саратовским ОГПУ.
386;Арестован Баландинским РА ОГПУ.
387;Арестован ГПУ Мариетальского кантона.
388;Арестован КНВД по Казахстану.
389;Арестован НКВД ст. Астрахань.
390;Арестован Краснокутским КО НКВД.
391;Арестован Турковским РО УНКВД.
392;Арестован ОО НКВД 61 Армии.
393;Арестован Краснокутским КО ГПУ РНП.
394;Арестован г, Турковским РО УНКВД.
395;Арестован Широко- Карамышским РО УНКВД.
396;Арестован ДТО НКГБ РУж.д.
397;Арестован Широко-Карамышским РО УНКВД.
398;Арестован Турковским РА ОГПУ.
399;Арестован ГО УНКВД.
400;Арестован ОДТО НКВД РУж.д.
401;Арестован Куриловским РО НКВД.
402;Арестован Пугачёвским РО УНКВД.
403;Арестован Озинским РО УНКВД.
404;Арестован Аткарским ОО ОГПУ НВК.
405;Арестован Турковским ОГПУ по НВК.
406;Арестован Екатериновским РО УНКВД.
407;Арестована РО УМГБ.
408;Арестована КО НКВД АССР НП.
409;Арестована КО УНКВД АССР.
410;Арестован ОТО НКВД.
411;Арестован ОС при НКВД СССР.
412;Арестован УМВД по Саратовской области.
413;Арестован Ново-Покровским РО УНКВД.
414;Арестован ОО НКВД 56 СД.
415;Арестован ТО НКВД. РУж.д.
416;Арестован Черкасским РО НКВД.
417;Арестован Алтайским РО УНКВД.
418;Арестована ГО УНКВД.
419;Арестован РО ОГПУ.
420;Арестован Вольским УНКВД.
421;Арестован Лизандер- гейским УНКВД.
422;Арестован ГПУ Мариентальского кантона.
423;Арестован Прокуратурой Балтайского района.
424;Арестован Базарно-Карабулакским РО УНКВД.
425;Арестован НКВД по Ленинградскому фронту.
426;Арестован Алтайским РО УНКВД по Саратовской области.
427;Арестован Макаровским РО УНКВД.
428;Арестован Красно-Партизанским РО НКВД.
429;Арестован ГПУ ЛенВО.
430;Арестован Романовским РО НКВД.
431;Арестован Пугачёвским ОГПУ.
432;Арестован Пугачёвским РО НКВД.
433;Арестован ДТО ГУГБ НКВД РУж.д..
434;Арестован Татищевским РА ОГПУ.
435;Арестован ОДТО НКВД ст. Аткарск РУж.д.
436;Арестован Черкасским РА ОГПУ.
437;Арестован Балтайским РО УНКВД.
438;Арестован Екатериновским РА ОГПУ.
439;Арестован Лизандергеймским КО НКВД.
