ARESTTYPEID;ARESTTYPE
2266;Арест. Головинщенским РО УНКВД по Пензенской области
2267;Арест. Н.Петровский РА ПП ОГПУ СВК
2268;Арест. Тамалинским РО УНКВД по Сар.обл.
2269;Арест. Хвалынским РО УГБ НКВД по Саратовской области
2270;Арест. Кузнецким Горрайотделом ПП ОГПУ СВК
2271;Арест. ОДТО ГУГБ НКВД по Пензенской области
2272;Арест. Чаадаевским РО ПП ОГПУ СВК
2273;Арест. Иссинским РО УНКВД по Пензенской области
2274;Арест. Чембарским РА УНКВД по Куйб.обл.
2275;Арест. Бековским УНКВД по Саратовской области
2276;Арест. УНКВД по Пензенск.обл.
2277;Арест. УНКВД Горьковской области
2278;Арест. ОО НКВД 326 СД
2279;Арест. Даниловским РО УНКВД по Пенз.обл.
2280;Арест. Пензенск. ГО УНКВД по Куйбыш.обл.
2281;Арест. Пензенским Горотделом УНКВД Куйбышевского края
2282;Арест. Городищ. РО УНКВД Куйб. Обл
2283;Арест. Мокшанским РО УНКВД Тамб.обл.
2284;Арест. Б.Демьяновским РА ПП ОГПУ СВК
2285;Арест. ОТО НКВД ст.Пенза 1, Пензенской области
2286;Арест. Колышлейским РО УНКВД Сар.Края
2287;Арест. Пензенский горотдел ОГПУ СВК
2288;Арест. Иссинским РО УНКВД Тамб.обл.
2289;Арест. Бессоновским РО УНКВД по Пенз.обл.
2290;Арест. Кондольским РА ПП ОГПУ СВО
2291;Арест. Бессоновским РО УНКВД Тамб.ол.
2292;Арест. Н.Пестровским РО УНКВД Пензенской области
2293;Арест. ОДТО НКВД ст.Восполье Ярославской ж/д
2294;Арест. Н.Ломовским РО УНКВД Тамбовской области
2295;Арест. Соседск.РО УНКВД Тамб.обл.
2296;Арест. Земетчинским РО УНКВД по Воронежской области
2297;Арест. Пензенским горотделом УНКВД Тамбовской области
2298;Арест. Иссинским РО УНКВД по Куйбышевской области
2299;Арест. Лопатинским РО УНКВД Саратовской обл.
2300;Арест. Бековским РОМ УНКВД по Сарат.обл.
2301;Арест. Б.Демьяновским РО УНКВД по Пензенской области
2302;Арест. Свищевский РО УНКВД по Куйб. Краю
2303;Арест. Пачелмским РО УМГБ по Пензенской области
2304;Арест. Управление МГБ по Пенз.обл.
2305;Арест. ОО ОГПУ Пенз.Лаг.Сбор.
2306;Арест. Мокшанским РА ПП ОГПУ НВК
2307;Арест. М.-Сердобинским РО УНКВД по Пенз.обл.
2308;Арест. Свищевским РО УНКВД по Тамбовской области
2309;Арест. Вертуновским ОДТО УГБ УНКВД Саратовской области
2310;Арест. Балашовским Окр.отделом ОГПУ НВК
2311;Арест. Шемышейским РО УНКВД Тамбовской области
2312;Арест. Лунинским РО УНКВД по СВК
2313;Арест. Бековским РО УНКВД
2314;Арест. Н.Ломовским РО УНКГБ Пензенской области
2315;Арест. Николо-Пестровс. Райаппарат ПП ОГПУ по СВК
2316;Арест. Б.Демьяновским РО УНКВД по Тамб.обл.
2317;Арест. Пенз.Сект.УНКВД по Сарат.краю
2318;Арест. Пензенский Опер. Сектор ОГПУ СВК
2319;Арест. Шемышейским РА ОГПУ СВК
2320;Арест. М.Сердоинским РА ПП ОГПУ НВК
2321;Арест. Головинщенским РО УНКВД Пенз.обл.
2322;Арест. Вадинским РО УНКВД по Пензенской области
2323;Арест. Б.-Вьясским РО УНКВД по Куйб.обл.
2324;Арест. Шемышейским РО УНКВД по Куйбышевской области
2325;Арест. Наровчатским РА ОГПУ СВК
2326;Арест. Еланским РА ПП ОГПУ СВО
2327;Арест. Пенз. ГО УНКВД по Тамб.обл.
2328;Арест. Пенз.Горотдел УНКВД Тамб.обл.
2329;Арест. Пенз.ГО УНКВД по Куйб.кр.
2330;Арест. Кузнецким РО УНКВД по Куйб.краю
2331;Арест. Пензенский ГО УНКВД по Тамбовской области
2332;Арест. Сердобским РО УНКВД Пензенской области
2333;Арест. М.Сердобинским РО УНКВД по Сар. Обл.
2334;Арест. ОДТО ОГПУ ст.Ртищево НВК
2335;Арест. Пенз.ОО ПП ОГПУ НВК
2336;Арест. Вяземским ЛАГ УНКВД
2337;Арест. Наровчатским РО УНКВД по Куйбышевской области
2338;Арест. Пенз.Го УНКВД по Куйб.краю
2339;Арест. Сердобским РО УНКВД по Сарат. Обл
2340;Арест. Шемышейским РО УНКВД Тамб.обл.
2341;Арест. Пачелмский РО ПП ОГПУ по Куйб. Обл.
2342;Арест. Пачелмским РО ПП ОГПУ по Куйб.обл.
2343;Арест. ОДТО УНКВД Пензенской ж/д
2344;Арест. Каменским РО УНКВД по Куйб.краю
2345;Арест. Б.Демьяновским РО НКВД
2346;Арест. Пенз.ОО ОГПУ СВК
2347;Арест. Тамалинским РО УНКВД по Сарат.обл.
2348;Арест. Н.Пестровским РО УНКВД по Куйбышевской области
2349;Арест. Соседским РА ПП ОГПУ СВК
2350;Арест. Пензенским ГО НКВД
2351;Арест. Чембарским РО УНКВД Пенз.обл.
2352;Арест. Чембарским РО УНКВД по Пензенской области
2353;Арест. Пензенский ОРГ сектор ОГПУ
2354;Арест. Даниловским РО УНКВД Сарат.обл.
2355;Арест. Лунинским РО УНКВД Пензенской области
2356;Арест. Пензенским ОРГ сект. ПП ОГПУ СВК
2357;Арест. Лопатинским РО УНКВД по Сарат.обл.
2358;Арест. Пенз ГО УГБ НКВД СССР по Тамбовской области
2359;Арест. Пензенским КРО УНКВД по Пензенской области
2360;Арест. Пензенский ГО УНКВД по Куйбышевской области
2361;Арест. Даниловским РО УНКВД по Саратовской обл.
2362;Арест. Пенз.РА ПП ОГПУ СВК
2363;Арест. Пенз.РА ОГПУ СВК
2364;Арест. Пенз.Гор.отдел УНКВД Тамб.обл.
2365;Арест. УНКВД по Куйб.обл.
2366;Арест. ОДТО ГУГБ ст.Ртищево Р.У. ж/д
2367;Арест. Н-Ломовским РА ПП ОГПУ СВК
2368;Арест. Б.Вьясским РО УНКГБ Пензенской области
2369;Арест. УНКВД по Тамб.обл.
2370;Арест. Лунинский РО УНКВД Пенз.обл.
2371;Арест. Кузнецким РО УМГБ по Пенз.обл.
2372;Арест. Чаадаевский РО ОГРУ СВК
2373;Арест. Камешкирским РО ОГПУ по Кйб.кр
2374;Арест. Пенз.ГО УНКВД по Саратовской области
2375;Арест. Чембарским ПП ОГПУ СВК
2376;Арест. Пенз.Окр.Отдел ОГПУ СВО по Чембарскому р-ону
2377;Арест. Лунинским РО УНКВД по Куйбышевскому краю
2378;Арест. Кузнецким Окротдел ПП ОГПУ СВК
2379;Арест. Пенз.ГО ПП ОГПУ СВК
2380;Арест. Пенз.Горотдел ОГПУ СВК
2381;Арест. Чембарский РА ПП ОГПУ СВК
2382;Арест. Н.-пестровским РО ОГПУ СВК
2383;Арест. ОТО УНКВД Пензенской области
2384;Арест. УГБ УНКВД по Тамбовской области
2385;Арест. Башмаковским РО УНКВД Тамб.обл.
2386;Арест. ОДТО ГУГБ УНКВД ст.Пенза
2387;Арест. Пенз.Окр.Отдел ОГПУ СВО по Керенскому р-ону
2388;Арест. голицынским РО УНКВД Тамбовской области
2389;Арест. Н. Ломовским РО ПП ОГПУ СВК
2390;Арест. Мокшанским РО УНКВД по Куйбышевскому Краю
2391;Арест. Кузнецким РО УНКВД Пензенской области
2392;Арест. Чембарским РО ПП ОГПУ по СВК
2393;Арест. ПП ОГПУ НВК по Лопатинскому району
2394;Арест. Н.Пестровский РО УНКВД Пенз.обл.
2395;Арест. Н.Пестровским РО УНКВД Пенз.обл.
2396;Арест. Пензенским Горрайотделом ОГПУ СВК
2397;Арест. Сердобским РО УНКВД по Саратовской обл.
2398;Арест. ОДТО ГУГБ УНКВД ст.Пенза 1 Ленинск.ж/д
2399;Арест. Пенз.ГО УНКВД по Пензенской области
2400;Арест. Шемышейским РО УНКВД по Пенз.обл
2401;Арест. Телегинским РО УНКВД по Тамб. Обл
2402;Арест. Н.-Ломовским РО УНКВД по Тамб.обл.
2403;Арест. Сердобинский РО УНКВД по Саратовской области
2404;Арест. Кузнецкий Окр.отдел ОГПУ СВК
2405;Арест. особым отделом ОГПУ Пензенского лагсбора СВК
2406;Арест. Керенским РО УНКВД по Куйбышевской области
2407;Арест. Мокшанским РО УНКВД Пензенской области
2408;Арест. Петровским РО ПП ОГПУ НВК
2409;Арест. Управление НКВД Ивановской области
2410;Арест. Тамалинским РО УНКВД по Сарат.кр.
2411;Арест. Колышлейским РО УНКВД Саратовской обалсти
2412;Арест. УНКВД Куйбышевскому краю
2413;Арест. ОО спеылагерь №283
2414;Арест. Шемышейским РО УНКВД Тамб. Обл
2415;Арест. Кондольским РО УНКВД Тамбовской области
2416;Арест. ОДТО УНКВД ст.Пенза-1 Пенз.обл.
2417;Арест. Кондольским РО УНКВД по Тамб.обл.
2418;Арест. Иссинским РО УНКВД Куйбышевской области
2419;Арест. Каменским РО УНКВД Пенз.обл.
2420;Арест. УМГБ по Пенз.обл.
2421;Арест. Н.-Пестровским РО НКВД по Куйб обл.
2422;Арест. Сердобским РО УНКВД Саратовской краю
2423;Арест. Чембарское РО ОГПУ СВК
2424;Арест. Пензенский гор.отдел НКВД по Тамбовской области
2425;Арест. Иссинским РО НКВД по Куйб.Краю
2426;Арест. Б-Демьяновским РО УНКВД по Тамб. Обл
2427;Арест. УГБ УНКВД по Куйбышевской области
2428;Арест. Н.Пестровским РО НКГБ по Пензенской области
2429;Арест. Лопатинским РО УНКВД по Сар. обл.
2430;Арест. Пензенский Опер.Сектор ОГПУ СВК
2431;Арест. Кузнецким ГО УНКВД по Пенз.обл.
2432;Арест. М.Сердобинским РО УНКВД по Сарат.кр.
2433;Арест. Пенз.Сектор УНКВД СВК
2434;Арест. Лунинским РО УНКВД Куйбышевской области
2435;Арест. ОО ГУГБ УНКВД ПРИВО Куйбышевской области
2436;Арест. ОДТО УНКВД ст. Ртищево Р-У ж/д
2437;Арест. Управление НКВД СССР по Заподной обл.
2438;Арест. Керенским РО УНКВД Куйбышевской области
2439;Арест. Кондольским РО УНКВД по Саратовской области
2440;Арест. Пачелмским РО УНКВД Тамбовской области
2441;Арест. Наровчатск.РО ПП ОГПУ СВК
2442;Арест. Пензенским Сектором УНКВД по СВК
2443;Арест. СПО УНКВД по Пензенской области
2444;Арест. М.Сердобинским РО УНКВД по Сарат.обл.
2445;Арест. Управление НКВД Пенз.обл.
2446;Арест. Кузнецк.РО УНКВД по Куйбыш.Краю
2447;Арест. Поимским РО УНКВД Куйбышевской области
2448;Арест. ТамалинскимРО УНКВД Сар.обл.
2449;Арест. Опер.Сект.ПП ОГПУ СВК
2450;Арест. Белинским РА ПП ОГПУ СВК
2451;Арест. Б.Демьяновским РО УНКВД Куйб.обл.
2452;Арест. ОДТО ГУГБ УНКВД ст.Ртищево Р.У.ж/д
2453;Арест. Тамалинским РО УНКВД по Сарат.краю
2454;Арест. Литвиновск. РО НКВД
2455;Арест. Бековским РО УНКГБ по Пенз.обл.
2456;Арест. Пензенским Окротделом ПП ОГПУ СВК
2457;Арест. Каменским РО УНКВД по Пензенской области
2458;Арест. Терновским РО УНКВД по Пензенской области
2459;Арест. Колышлейским РО УНКВД по Пензенской области
2460;Арест. Поимским РО УНКВД Куйб.обл.
2461;Арест. Иссинским РО УНКГБ Пензенской области
2462;Арест. Кузнецким РА ОГПУ СВК
2463;Арест. Н.Пестровским РО УНКВД Куйб.обл.
2464;Арест. Бековск. РО УНКВД Сарат.обл.
2465;Арест. Н.Пестровский РО УГБ НКВД СВК
2466;Арест. Камешкирским РО УНКВД по Пенз.обл.
2467;Арест. Земетчинским РА ПП ОГПУ ЦЧО
2468;Арест. Сердобским РО УНКГБ по Пензенской области
2469;Арест. Даниловским РО УМГБ по Пензенской области
2470;Арест. Шемышейским РО УНКВД по Тамбовской обл.
2471;Арест. Пенз.ГО УНКВД по Сарат.обл.
2472;Арест. Кузнецким Окр.отделом ПП ОГПУ СВК
2473;Арест. Камешкир.РО ПП ОГПУ СВК
2474;Арест. Н.-Ломовский РО ОГПУ СВК
2475;Арест. Лунинск.РО ПП ОГПУ СВК
2476;Арест. Головищенским РО УНКВД Тамбовской области
2477;Арест. Пенз.Опер. Сект. ПП ОГПУ СВК
2478;Арест. Пензенский ОО ОГПУ СВК
2479;Арест. ОО КРО Кузнецким ОО ОГПУ СВК
2480;Арест. Опер.Часть Пенз.Трудкол.УНКВД по Тамб.обл.
2481;Арест. М.Сердобинским РО УНКВД по Сарат. Краю
2482;Арест. Бековским УНКВД Сарт.обл.
2483;Арест. УГБ НКВД по Сарат. Обл.
2484;Арест. Сердобский РО УНКВД по Сар. Кр.
2485;Арест. Кузнец.ГО УНКВД Пенз.обл.
2486;Арест. Даниловским РО УНКВД по Тамбовской области
2487;Арест. Пензенским ГО УНКВД по Тамбовск.обл.
2488;Арест. Наровчатским РО УНКГБ по Пенз.обл.
2489;Арест. Лунинским РА ПП ОГПУ СВО
2490;Арест. Сердоюским РО УНКВД по Саратовской области
2491;Арест. Вадинским РО УНКВД Пензенской области
2492;Арест. Камешкирским ОС ОГПУ СВК
2493;Арест. ОДТО Р.У.ж/д УНКВД ст.Ртищево
2494;Арест. Телегинским РО УНКВД по Тамб.обл.
2495;Арест. Голицинским РО УНКВД по Пензенской области
2496;Арест. М.Сердобинским РО УНКВД по Сар.обл.
2497;Арест. Головинщенским РО УНКВД Тамб.обл.
2498;Арест. Пенз.СПО ОГПУ СВК
2499;Арест. Башмаковским РО УНКВД Пенз.обл.
2500;Арест. Башмаковским РО УНКВД по Куйб.обл.
2501;Арест. Н.Пестровским РО УНКВД СВК
2502;Арест. Кузнецким ГО УНКВД по Куйбышевской области
2503;Арест. М.Сердобинским РО УНКВД по Сар. Кр.
2504;Арест. Управлением НКГБ по Пензенской области
2505;Арест. Колышлейский РО УНКВД по Саратовской области
2506;Арест. Н.-Пестровским РО УНКВД по СВК
2507;Арест. Пачелмским РО УНКВД по Куйб.обл.
2508;Арест. Кузнецким РО УНКГБ по Пензенской области
2509;Арест. Сердобским РО УНКВД Сарат. Обл.
2510;Арест. Каменское РО УНКВД по Тамб.обл.
2511;Арест. ГУГБ УНКВД по Тамбовской области
2512;Арест. Н.Ломовским РО ОГПУ СВК
2513;Арест. Пензенский сектор НКВД СВК
2514;Арест. ДТО ГУГБ НКВД Ленинской ж/д
2515;Арест. Каменским РО УНКВД СВК
2516;Арест. Тамалинским РО УГБ НКВД по Саратовской области
2517;Арест. УНКВД ст. Пенза Ленинской ж/д
2518;Арест. Терновским РО УМГБ по Пензенской области
2519;Арест. Пенз. Опер. Сект.УНКВД по Куйб.кр
2520;Арест. Пензенским Оперсект. ПП ОГПУ СВК
2521;Арест. Пензенским ГО УНКВД куйбышевской обл.
2522;Арест. Шемышейским РО УНКВД Куйб.обл.
2523;Арест. Пачелмским РО ПП ОГПУ СВК
2524;Арест. Каменским ГО УНКВД по Пенз.обл.
2525;Арест. Голицинским РО УНКВД Куйб.края
2526;Арест. Каменским РА УНКВД по Тамбовской области
2527;Арест. Земетчинским РО УНКВД Тамб.обл.
2528;Арест. Шемышейским РО УНКВД по Куйб.обл.
2529;Арест. ОДТО ГУГБ НКВД Пенза
2530;Арест. Неверкинским РО УНКВД по Куйб.краю
2531;Арест. Опер.Пункт ТО ОГПУ ст.Сызрань-1
2532;Арест. Лопатинским РО УНКВД Пензенской области
2533;Арест. Кузнецким РО УНКВД по Куйбышевскому Краю
2534;Арест. Кузнецким РО УНКВД Пенз.обл.
2535;Арест. Наровчатским РОМ УНКВД по Пензенской области
2536;Арест. Наровчатский РО УНКВД Тамбовской области
2537;Арест. Пачелмский РА ПП ОГПУ СВК
2538;Арест. Пензенским ГО УНКВД по Саратовской области
2539;Арест. УГБ НКВД по Срат. Обл.
2540;Арест. УНКГБ по Пенз.обл.
2541;Арест. Кузн.РО УНКВД СВК
2542;Арест. Тамалинским РА УНКВД по Саратовской области
2543;Арест. Шемышейским РО УНКВД
2544;Арест. ОДТО ОГПУ СВК
2545;Арест. Экономическое отделение ПП ОГПУ ЦЧО
2546;Арест. Башмак. РО УНКВД по Куйб.краю
2547;Арест. Кузнецким РО УНКГБ Пензенской области
2548;Арест. УНКВД по Пензенской обл.
2549;Арест. Башмаковским РО УНКГБ Пенз.обл.
2550;Арест. Башмаковским РА при ПП ОГПУ СВК
2551;Арест. Пенз.Окр.Отделом ПП ОГПУ СВК
2552;Арест. Городищенским РО УНКВД Тамбовской обалсти
2553;Арест. управлением контрразведки МГБ Сереной группы войск
2554;Арест. Свищевским РО УНКГБ по Пенз.обл.
2555;Арест. М.Сердобсинским РО УНКВД Саратовской области
2556;Арест. Чембарским РО УНКГБ по Пензенской области.Пестровским РО НКГБ по Пензенской области
2557;Арест. УНГБ по Рязанской области
2558;Арест. Б.Демьяновским РО УНКВД по Куйбышевской области
2559;Арест. Лопатинским РО УНКВД Сарат.края
2560;Арест. Б.Демьяновским РО УНКВД Тамбовской области
2561;Арест. Пенз.Опер.Сект.ПП ОГПУ ПРИВО
2562;Арест. ОДТО ГУГБ НКВД г.Пенза
2563;Арест. Неверкинским РО УНКВД по Куйбышевской области
2564;Арест. ОО УНКВД по Московскому округу
2565;Арест. Земетчинским РО УНКВД по Саратовской области
2566;Арест. Кузнецким РО УМГБ Пенз.обл.
2567;Арест. Земетчинским РО НКВД Тамбовской области
2568;Арест. Башмаковским Райаппаратом ОГПУ СВК
2569;Арест. Тамалинским РО ГБ УНКВД по Саратовской обл.
2570;Арест. М.Сердобинским РО УНКВД по Сарат.краю
2571;Арест. Литвиновским РО УНКВД Куйбышевского края
2572;Арест. Шемышейским РО УНКВД Тамб обл.
2573;Арест. Камешкирским РО ПП ОГПУ по СВК
2574;Арест. ОДТО ГУГБ УНКВД Ряз.Урал. Ж/д
2575;Арест. Бессоновским РО УНКВД по Куйбышевской области
2576;Арест. Бесоновским РО УНКВД по Куйбышевскому Краю
2577;Арест. Мокшанским РА ОГПУ СВК
2578;Арест. Салтыковским РО УНКВД по Пензенской области
2579;Арест. Лунинский РО ОГПУ СВК
2580;Арест. Башмаковским РО ОГПУ
2581;Арест. Пенз.сект.УНКВД по СВК
2582;Арест. Пенз.сект. УНКВД СВК
2583;Арест. Н.-Ломовским РО УНКВД по Куйб.обл.
2584;Арест. Башмаковским РО УНКВД по Куйбышевской области
2585;Арест. Лунинским РО УНКВД по Пензенской области
2586;Арест. Соседским РО УНКВД Воронежской области
2587;Арест. Тамбовским Опер Сектором ОГПУ ЦЧО
2588;Арест. Телегинское РО УНКВД по Тамбовский обл.
2589;Арест. Сызраньским Опер Сектором ОГПУ СВК
2590;Арест. М.Сердобинский РО УНКВД по Саратовскому кр.
2591;Арест. М.Сердобским РО УНКВД Сарат.Краю
2592;Арест. Чембарским РО УНКВД Тамб.обл.
2593;Арест. ОДТО ГУГБ УНКВД ст.Ртищево РУ ж/д
2594;Арест. Пензенским РА ОГПУ СВК
2595;Арест. Тамалинским РО УНКВД по Сар. Обл
2596;Арест. ДТО УНКВД Пенз.ж/дор.
2597;Арест. Каменским РО УНКВД по Куйбышевскому Краю
2598;Арест. Бековским РО УНКВД по Сарат.Краю
